{
    "citation": {
        "document-type": "journal",
        "title": "Second-nearest-neighbor modified embedded-atom method interatomic potential for Cu-M (M = Co, Mo) binary systems",
        "author": [
            {
                "given-name": "J.",
                "surname": "Wang"
            },
            {
                "given-name": "S.-H.",
                "surname": "Oh"
            },
            {
                "given-name": "B.-J.",
                "surname": "Lee"
            }
        ],
        "publication-name": "Computational Materials Science",
        "publication-date": {
            "year": 2020
        },
        "volume": 178,
        "abstract": "Second-nearest-neighbor modified embedded-atom method (2NN MEAM) interatomic potentials for Cu-M (M = Co, Mo) binary systems have been developed. The Cu-M potentials can be extended to Pt-Cu-M ternary 2NN MEAM potentials being combined with already existing Pt-M potentials and can be utilized for atomistic simulations to design inexpensive and efficient platinum alloy catalysts. The potentials reproduce fundamental material properties such as structural and thermodynamic properties of compound and solution phases in reasonable agreement with experimental data. Herein, the validity of the developed potentials for atomistic simulation is ascertained.",
        "pages": 109627,
        "DOI": "10.1016/j.commatsci.2020.109627",
        "bibtex": "@article{Wang_2020,\n abstract = {Second-nearest-neighbor modified embedded-atom method (2NN MEAM) interatomic potentials for Cu-M (M = Co, Mo) binary systems have been developed. The Cu-M potentials can be extended to Pt-Cu-M ternary 2NN MEAM potentials being combined with already existing Pt-M potentials and can be utilized for atomistic simulations to design inexpensive and efficient platinum alloy catalysts. The potentials reproduce fundamental material properties such as structural and thermodynamic properties of compound and solution phases in reasonable agreement with experimental data. Herein, the validity of the developed potentials for atomistic simulation is ascertained.},\n author = {Jaemin Wang and Sang-Ho Oh and Byeong-Joo Lee},\n doi = {10.1016/j.commatsci.2020.109627},\n journal = {Computational Materials Science},\n month = {jun},\n pages = {109627},\n publisher = {Elsevier BV},\n title = {Second-nearest-neighbor modified embedded-atom method interatomic potential for Cu-M (M = Co, Mo) binary systems},\n url = {https://doi.org/10.1016%2Fj.commatsci.2020.109627},\n volume = {178},\n year = {2020}\n}\n\n"
    }
}