{
    "citation": {
        "document-type": "journal",
        "title": "Modified embedded-atom method interatomic potentials for Mg-Nd and Mg-Pb binary systems",
        "author": [
            {
                "given-name": "K.-H.",
                "surname": "Kim"
            },
            {
                "given-name": "B.-J.",
                "surname": "Lee"
            }
        ],
        "publication-name": "Calphad",
        "publication-date": {
            "year": 2017
        },
        "volume": 57,
        "abstract": "Interatomic potentials for the Mg-Nd and Mg-Pb binary systems have been developed within the framework of the second nearest-neighbor modified embedded-atom method (2NN MEAM) formalism. The potentials describe a wide range of fundamental materials properties (thermodynamic, structural and elastic properties of compound and solution phases) of relevant systems in reasonable agreement with experimental data or first-principles and CALPHAD calculations. The applicability of the developed potentials to atomistic simulations on deformation behavior in Mg and its alloys is demonstrated by showing that the potentials reproduce related material properties reasonably and are transferable sufficiently.",
        "pages": "55-61",
        "DOI": "10.1016/j.calphad.2017.03.003",
        "bibtex": "@article{Kim_2017,\n abstract = {Interatomic potentials for the Mg-Nd and Mg-Pb binary systems have been developed within the framework of the second nearest-neighbor modified embedded-atom method (2NN MEAM) formalism. The potentials describe a wide range of fundamental materials properties (thermodynamic, structural and elastic properties of compound and solution phases) of relevant systems in reasonable agreement with experimental data or first-principles and CALPHAD calculations. The applicability of the developed potentials to atomistic simulations on deformation behavior in Mg and its alloys is demonstrated by showing that the potentials reproduce related material properties reasonably and are transferable sufficiently.},\n author = {Ki-Hyun Kim and Byeong-Joo Lee},\n doi = {10.1016/j.calphad.2017.03.003},\n journal = {Calphad},\n month = {jun},\n pages = {55--61},\n publisher = {Elsevier BV},\n title = {Modified embedded-atom method interatomic potentials for Mg-Nd and Mg-Pb binary systems},\n url = {https://doi.org/10.1016%2Fj.calphad.2017.03.003},\n volume = {57},\n year = {2017}\n}\n\n"
    }
}