{
    "citation": {
        "document-type": "journal",
        "title": "Interaction potential for indium phosphide: a molecular dynamics and first-principles study of the elastic constants, generalized stacking fault and surface energies",
        "author": [
            {
                "given-name": "P.S.",
                "surname": "Branicio"
            },
            {
                "given-name": "J.P.",
                "surname": "Rino"
            },
            {
                "given-name": "C.K.",
                "surname": "Gan"
            },
            {
                "given-name": "H.",
                "surname": "Tsuzuki"
            }
        ],
        "publication-name": "Journal of Physics: Condensed Matter",
        "publication-date": {
            "year": 2009
        },
        "volume": 21,
        "issue": 9,
        "abstract": "Indium phosphide is investigated using molecular dynamics (MD) simulations and density-functional theory calculations. MD simulations use a proposed effective interaction potential for InP fitted to a selected experimental dataset of properties. The potential consists of two- and three-body terms that represent atomic-size effects, charge–charge, charge–dipole and dipole–dipole interactions as well as covalent bond bending and stretching. Predictions are made for the elastic constants as a function of density and temperature, the generalized stacking fault energy and the low-index surface energies.",
        "pages": "095002",
        "DOI": "10.1088/0953-8984/21/9/095002",
        "bibtex": "@article{Branicio_2009,\n abstract = {Indium phosphide is investigated using molecular dynamics (MD) simulations and density-functional theory calculations. MD simulations use a proposed effective interaction potential for InP fitted to a selected experimental dataset of properties. The potential consists of two- and three-body terms that represent atomic-size effects, charge–charge, charge–dipole and dipole–dipole interactions as well as covalent bond bending and stretching. Predictions are made for the elastic constants as a function of density and temperature, the generalized stacking fault energy and the low-index surface energies.},\n author = {Paulo Sergio Branicio and José Pedro Rino and Chee Kwan Gan and Hélio Tsuzuki},\n doi = {10.1088/0953-8984/21/9/095002},\n journal = {Journal of Physics: Condensed Matter},\n month = {jan},\n number = {9},\n pages = {095002},\n publisher = {IOP Publishing},\n title = {Interaction potential for indium phosphide: a molecular dynamics and first-principles study of the elastic constants, generalized stacking fault and surface energies},\n url = {https://doi.org/10.1088%2F0953-8984%2F21%2F9%2F095002},\n volume = {21},\n year = {2009}\n}\n\n"
    }
}