{
    "citation": {
        "document-type": "journal",
        "title": "A highly transferable and efficient machine learning interatomic potentials study of α-Fe–C binary system",
        "author": [
            {
                "given-name": "F.-S.",
                "surname": "Meng"
            },
            {
                "given-name": "S.",
                "surname": "Shinzato"
            },
            {
                "given-name": "S.",
                "surname": "Zhang"
            },
            {
                "given-name": "K.",
                "surname": "Matsubara"
            },
            {
                "given-name": "J.-P.",
                "surname": "Du"
            },
            {
                "given-name": "P.",
                "surname": "Yu"
            },
            {
                "given-name": "W.-T.",
                "surname": "Geng"
            },
            {
                "given-name": "S.",
                "surname": "Ogata"
            }
        ],
        "publication-name": "Acta Materialia",
        "publication-date": {
            "year": 2024
        },
        "volume": 281,
        "abstract": "Machine learning interatomic potentials (MLIPs) for α-iron and carbon binary system have been constructed aiming for understanding the mechanical behavior of Fe–C steel and carbides. The MLIPs were trained using an extensive reference database produced by spin polarized density functional theory (DFT) calculations. The MLIPs reach the DFT accuracies in many important properties which are frequently engaged in Fe and Fe–C studies, including kinetics and thermodynamics of C in α-Fe with vacancy, grain boundary, and screw dislocation, and basic properties of cementite and cementite–ferrite interfaces. In conjunction with these MLIPs, the impact of C atoms on the mobility of screw dislocation at finite temperature, and the C-decorated core configuration of screw dislocation were investigated, and a uniaxial tensile test on a model with multiple types of defects was conducted.",
        "pages": "120408",
        "DOI": "10.1016/j.actamat.2024.120408",
        "bibtex": "@article{Meng_2024,\n abstract = {Machine learning interatomic potentials (MLIPs) for α-iron and carbon binary system have been constructed aiming for understanding the mechanical behavior of Fe–C steel and carbides. The MLIPs were trained using an extensive reference database produced by spin polarized density functional theory (DFT) calculations. The MLIPs reach the DFT accuracies in many important properties which are frequently engaged in Fe and Fe–C studies, including kinetics and thermodynamics of C in α-Fe with vacancy, grain boundary, and screw dislocation, and basic properties of cementite and cementite–ferrite interfaces. In conjunction with these MLIPs, the impact of C atoms on the mobility of screw dislocation at finite temperature, and the C-decorated core configuration of screw dislocation were investigated, and a uniaxial tensile test on a model with multiple types of defects was conducted.},\n author = {Meng, Fan-Shun and Shinzato, Shuhei and Zhang, Shihao and Matsubara, Kazuki and Du, Jun-Ping and Yu, Peijun and Geng, Wen-Tong and Ogata, Shigenobu},\n doi = {10.1016/j.actamat.2024.120408},\n issn = {1359-6454},\n journal = {Acta Materialia},\n month = {December},\n pages = {120408},\n publisher = {Elsevier BV},\n title = {A highly transferable and efficient machine learning interatomic potentials study of α-Fe–C binary system},\n url = {http://dx.doi.org/10.1016/j.actamat.2024.120408},\n volume = {281},\n year = {2024}\n}\n"
    }
}