{
    "citation": {
        "document-type": "journal",
        "title": "Development of glue-type potentials for the Al-Pb system: phase diagram calculation",
        "author": [
            {
                "given-name": "A.",
                "surname": "Landa"
            },
            {
                "given-name": "P.",
                "surname": "Wynblatt"
            },
            {
                "given-name": "D.J.",
                "surname": "Siegel"
            },
            {
                "given-name": "J.B.",
                "surname": "Adams"
            },
            {
                "given-name": "O.N.",
                "surname": "Mryasov"
            },
            {
                "given-name": "X.-Y.",
                "surname": "Liu"
            }
        ],
        "publication-name": "Acta Materialia",
        "publication-date": {
            "year": 2000
        },
        "volume": 48,
        "issue": 8,
        "abstract": "Empirical many-body potentials of the glue-type have been constructed for the Al–Pb system using the \"force matching\" method. The potentials are fitted to experimental data, physical quantities derived from ab initio linear muffin-tin orbitals calculations and a massive quantum mechanical database of atomic forces generated using ultrasoft pseudopotentials in conjunction with ab initio molecular statics simulations. Monte Carlo simulations using these potentials have been employed to compute an Al–Pb phase diagram which is in fair agreement with experimental data.",
        "pages": "1753-1761",
        "DOI": "10.1016/s1359-6454(00)00002-1",
        "bibtex": "@article{Landa_2000,\n abstract = {Empirical many-body potentials of the glue-type have been constructed for the Al–Pb system using the \"force matching\" method. The potentials are fitted to experimental data, physical quantities derived from ab initio linear muffin-tin orbitals calculations and a massive quantum mechanical database of atomic forces generated using ultrasoft pseudopotentials in conjunction with ab initio molecular statics simulations. Monte Carlo simulations using these potentials have been employed to compute an Al–Pb phase diagram which is in fair agreement with experimental data.},\n author = {A. Landa and P. Wynblatt and D.J. Siegel and J.B. Adams and O.N. Mryasov and X.-Y. Liu},\n doi = {10.1016/s1359-6454(00)00002-1},\n journal = {Acta Materialia},\n month = {may},\n number = {8},\n pages = {1753--1761},\n publisher = {Elsevier BV},\n title = {Development of glue-type potentials for the Al-Pb system: phase diagram calculation},\n volume = {48},\n year = {2000}\n}\n\n"
    }
}