{
    "citation": {
        "document-type": "journal",
        "title": "Modified embedded-atom method interatomic potentials for the Co-Cr, Co-Fe, Co-Mn, Cr-Mn and Mn-Ni binary systems",
        "author": [
            {
                "given-name": "W.-M.",
                "surname": "Choi"
            },
            {
                "given-name": "Y.",
                "surname": "Kim"
            },
            {
                "given-name": "D.",
                "surname": "Seol"
            },
            {
                "given-name": "B.-J.",
                "surname": "Lee"
            }
        ],
        "publication-name": "Computational Materials Science",
        "publication-date": {
            "year": 2017
        },
        "volume": 130,
        "abstract": "Interatomic potentials for the Co-Cr, Co-Fe, Co-Mn, Cr-Mn and Mn-Ni binary systems have been developed in the framework of the second nearest-neighbor modified embedded-atom method (2NN MEAM) formalism. The potentials describe various fundamental alloy behaviors (structural, elastic and thermodynamic behavior of solution and compound phases), mostly in reasonable agreements with experimental data or first-principles calculations. The potentials can be utilized to complete the interatomic potential for the CoCrFeMnNi alloy and to investigate the atomic scale physical metallurgy of high entropy alloys.",
        "pages": "121-129",
        "DOI": "10.1016/j.commatsci.2017.01.002",
        "bibtex": "@article{Choi_2017,\n abstract = {Interatomic potentials for the Co-Cr, Co-Fe, Co-Mn, Cr-Mn and Mn-Ni binary systems have been developed in the framework of the second nearest-neighbor modified embedded-atom method (2NN MEAM) formalism. The potentials describe various fundamental alloy behaviors (structural, elastic and thermodynamic behavior of solution and compound phases), mostly in reasonable agreements with experimental data or first-principles calculations. The potentials can be utilized to complete the interatomic potential for the CoCrFeMnNi alloy and to investigate the atomic scale physical metallurgy of high entropy alloys.},\n author = {Won-Mi Choi and Yongmin Kim and Donghyuk Seol and Byeong-Joo Lee},\n doi = {10.1016/j.commatsci.2017.01.002},\n journal = {Computational Materials Science},\n month = {apr},\n pages = {121--129},\n publisher = {Elsevier BV},\n title = {Modified embedded-atom method interatomic potentials for the Co-Cr, Co-Fe, Co-Mn, Cr-Mn and Mn-Ni binary systems},\n url = {https://doi.org/10.1016%2Fj.commatsci.2017.01.002},\n volume = {130},\n year = {2017}\n}\n\n"
    }
}