{
    "citation": {
        "document-type": "journal",
        "title": "Modified embedded-atom method interatomic potentials for Al-Ti, Al-Ta, Al-Zr, Al-Nb and Al-Hf binary intermetallic systems",
        "author": [
            {
                "given-name": "R.",
                "surname": "Fereidonnejad"
            },
            {
                "given-name": "A.O.",
                "surname": "Moghaddam"
            },
            {
                "given-name": "M.",
                "surname": "Moaddeli"
            }
        ],
        "publication-name": "Computational Materials Science",
        "publication-date": {
            "year": 2022
        },
        "volume": 213,
        "abstract": "Interatomic potentials for the Al-Ti, Al-Ta, Al-Zr, Al-Nb and Al-Hf binary systems have been developed based on the second nearest-neighbor modified embedded-atom method (2NN MEAM) formalism. The fundamental materials properties (structural, thermodynamic and elastic behaviors of different intermetallics) could be readily described with the potentials using molecular dynamic simulation (MD), in rational agreements with experimental or first principles data. The potentials are further utilized to develop an interatomic potential for the (TiZrNbHfTa)Al<sub>3</sub> high entropy intermetallic compound (HEIC), which open the door to understand atomic scale behavior of HEICs.",
        "pages": "111685",
        "DOI": "10.1016/j.commatsci.2022.111685",
        "bibtex": "@article{Fereidonnejad_2022,\n abstract = {Interatomic potentials for the Al-Ti, Al-Ta, Al-Zr, Al-Nb and Al-Hf binary systems have been developed based on the second nearest-neighbor modified embedded-atom method (2NN MEAM) formalism. The fundamental materials properties (structural, thermodynamic and elastic behaviors of different intermetallics) could be readily described with the potentials using molecular dynamic simulation (MD), in rational agreements with experimental or first principles data. The potentials are further utilized to develop an interatomic potential for the (TiZrNbHfTa)Al<sub>3</sub> high entropy intermetallic compound (HEIC), which open the door to understand atomic scale behavior of HEICs.},\n author = {Rahele Fereidonnejad and Ahmad Ostovari Moghaddam and Mohammad Moaddeli},\n doi = {10.1016/j.commatsci.2022.111685},\n journal = {Computational Materials Science},\n month = {oct},\n pages = {111685},\n publisher = {Elsevier BV},\n title = {Modified embedded-atom method interatomic potentials for Al-Ti, Al-Ta, Al-Zr, Al-Nb and Al-Hf binary intermetallic systems},\n url = {https://doi.org/10.1016%2Fj.commatsci.2022.111685},\n volume = {213},\n year = {2022}\n}\n\n"
    }
}