{
    "citation": {
        "document-type": "journal",
        "title": "Second nearest-neighbor modified embedded atom method interatomic potentials for the Na unary and Na-Sn binary systems",
        "author": [
            {
                "given-name": "Y.",
                "surname": "Kim"
            },
            {
                "given-name": "W.-S.",
                "surname": "Ko"
            },
            {
                "given-name": "B.-J.",
                "surname": "Lee"
            }
        ],
        "publication-name": "Computational Materials Science",
        "publication-date": {
            "year": 2020
        },
        "volume": 185,
        "abstract": "Interatomic potentials for pure sodium and sodium-tin binary systems are developed on the basis of the second nearest-neighbor modified embedded-atom method (2NN MEAM) formalism. The potentials can describe various fundamental materials properties such as structural, elastic, thermodynamic, and thermal properties in reasonable agreements with experimental data and density functional theory (DFT) calculations. It is demonstrated that the potentials can be used for the development of sodium-tin-X ternary potentials and atomistic simulations to understand material phenomena and to search for tin-based alloy anode materials for sodium ion batteries.",
        "pages": "109953",
        "DOI": "10.1016/j.commatsci.2020.109953",
        "bibtex": "@article{Kim_2020,\n abstract = {Interatomic potentials for pure sodium and sodium-tin binary systems are developed on the basis of the second nearest-neighbor modified embedded-atom method (2NN MEAM) formalism. The potentials can describe various fundamental materials properties such as structural, elastic, thermodynamic, and thermal properties in reasonable agreements with experimental data and density functional theory (DFT) calculations. It is demonstrated that the potentials can be used for the development of sodium-tin-X ternary potentials and atomistic simulations to understand material phenomena and to search for tin-based alloy anode materials for sodium ion batteries.},\n author = {Yongmin Kim and Won-Seok Ko and Byeong-Joo Lee},\n doi = {10.1016/j.commatsci.2020.109953},\n journal = {Computational Materials Science},\n month = {dec},\n pages = {109953},\n publisher = {Elsevier BV},\n title = {Second nearest-neighbor modified embedded atom method interatomic potentials for the Na unary and Na-Sn binary systems},\n url = {https://doi.org/10.1016%2Fj.commatsci.2020.109953},\n volume = {185},\n year = {2020}\n}\n\n"
    }
}