{
    "citation": {
        "document-type": "journal",
        "title": "Development and application of Ni-Ti and Ni-Al-Ti 2NN-MEAM interatomic potentials for Ni-base superalloys",
        "author": [
            {
                "given-name": "Y.-K.",
                "surname": "Kim"
            },
            {
                "given-name": "H.-K.",
                "surname": "Kim"
            },
            {
                "given-name": "W.-S.",
                "surname": "Jung"
            },
            {
                "given-name": "B.-J.",
                "surname": "Lee"
            }
        ],
        "publication-name": "Computational Materials Science",
        "publication-date": {
            "year": 2017
        },
        "volume": 139,
        "abstract": "Interatomic potentials for the Ni-Ti and Ni-Al-Ti systems have been developed based on the second nearest-neighbor modified embedded-atom method (2NN-MEAM) formalism. The Ni-Ti binary potential reproduces fundamental materials properties (structural, elastic, thermodynamic, and thermal stability) of alloy systems in reasonable agreement with experiments, first-principles calculations and thermodynamic calculations. Atomistic simulations using the Ni-Al-Ti ternary potential validate that the potential can be applied successfully to atomic-scale investigations to clarify the effects of titanium on important materials phenomena (site preference in γ', γ-γ' phase transition, and segregation on grain boundaries) in Ni-Al-Ti ternary superalloys.",
        "pages": "225-233",
        "DOI": "10.1016/j.commatsci.2017.08.002",
        "bibtex": "@article{Kim_2017,\n abstract = {Interatomic potentials for the Ni-Ti and Ni-Al-Ti systems have been developed based on the second nearest-neighbor modified embedded-atom method (2NN-MEAM) formalism. The Ni-Ti binary potential reproduces fundamental materials properties (structural, elastic, thermodynamic, and thermal stability) of alloy systems in reasonable agreement with experiments, first-principles calculations and thermodynamic calculations. Atomistic simulations using the Ni-Al-Ti ternary potential validate that the potential can be applied successfully to atomic-scale investigations to clarify the effects of titanium on important materials phenomena (site preference in γ', γ-γ' phase transition, and segregation on grain boundaries) in Ni-Al-Ti ternary superalloys.},\n author = {Young-Kwang Kim and Hong-Kyu Kim and Woo-Sang Jung and Byeong-Joo Lee},\n doi = {10.1016/j.commatsci.2017.08.002},\n journal = {Computational Materials Science},\n month = {nov},\n pages = {225--233},\n publisher = {Elsevier BV},\n title = {Development and application of Ni-Ti and Ni-Al-Ti 2NN-MEAM interatomic potentials for Ni-base superalloys},\n url = {https://doi.org/10.1016%2Fj.commatsci.2017.08.002},\n volume = {139},\n year = {2017}\n}\n\n"
    }
}