{
    "citation": {
        "document-type": "journal",
        "title": "Modified embedded-atom method interatomic potentials for the Ni-Co binary and the Ni-Al-Co ternary systems",
        "author": [
            {
                "given-name": "Y.-K.",
                "surname": "Kim"
            },
            {
                "given-name": "W.-S.",
                "surname": "Jung"
            },
            {
                "given-name": "B.-J.",
                "surname": "Lee"
            }
        ],
        "publication-name": "Modelling and Simulation in Materials Science and Engineering",
        "publication-date": {
            "year": 2015
        },
        "volume": 23,
        "issue": 5,
        "abstract": "Interatomic potentials for the Ni-Co binary and Ni-Al-Co ternary systems have been developed on the basis of the second nearest-neighbor modified embedded-atom method (2NN MEAM) formalism. The potentials describe structural, thermodynamic, deformation and defect properties of solid solution phases or compound phases in reasonable agreements with experiments or first-principles calculations. The results demonstrate the transferability of the potentials and their applicability to large-scale atomistic simulations to investigate the effect of an alloying element, cobalt, on various microstructural factors related to mechanical properties of Ni-based superalloys on an atomic scale.",
        "pages": "055004",
        "DOI": "10.1088/0965-0393/23/5/055004",
        "bibtex": "@article{Kim_2015,\n abstract = {Interatomic potentials for the Ni-Co binary and Ni-Al-Co ternary systems have been developed on the basis of the second nearest-neighbor modified embedded-atom method (2NN MEAM) formalism. The potentials describe structural, thermodynamic, deformation and defect properties of solid solution phases or compound phases in reasonable agreements with experiments or first-principles calculations. The results demonstrate the transferability of the potentials and their applicability to large-scale atomistic simulations to investigate the effect of an alloying element, cobalt, on various microstructural factors related to mechanical properties of Ni-based superalloys on an atomic scale.},\n author = {Young-Kwang Kim and Woo-Sang Jung and Byeong-Joo Lee},\n doi = {10.1088/0965-0393/23/5/055004},\n journal = {Modelling and Simulation in Materials Science and Engineering},\n month = {may},\n number = {5},\n pages = {055004},\n publisher = {IOP Publishing},\n title = {Modified embedded-atom method interatomic potentials for the Ni-Co binary and the Ni-Al-Co ternary systems},\n url = {https://doi.org/10.1088%2F0965-0393%2F23%2F5%2F055004},\n volume = {23},\n year = {2015}\n}\n\n"
    }
}