{
    "citation": {
        "document-type": "journal",
        "title": "Analytic bond-order potential for atomistic simulations of zinc oxide",
        "author": [
            {
                "given-name": "P.",
                "surname": "Erhart"
            },
            {
                "given-name": "N.",
                "surname": "Juslin"
            },
            {
                "given-name": "O.",
                "surname": "Goy"
            },
            {
                "given-name": "K.",
                "surname": "Nordlund"
            },
            {
                "given-name": "R.",
                "surname": "Müller"
            },
            {
                "given-name": "K.",
                "surname": "Albe"
            }
        ],
        "publication-name": "Journal of Physics: Condensed Matter",
        "publication-date": {
            "year": 2006
        },
        "volume": 18,
        "issue": 29,
        "abstract": "An interatomic potential for zinc oxide and its elemental constituents is derived based on an analytical bond-order formalism. The model potential provides a good description of the bulk properties of various solid structures of zinc oxide including cohesive energies, lattice parameters, and elastic constants. For the pure elements zinc and oxygen the energetics and structural parameters of a variety of bulk phases and in the case of oxygen also molecular structures are reproduced. The dependence of thermal and point defect properties on the cutoff parameters is discussed. As exemplary applications the irradiation of bulk zinc oxide and the elastic response of individual nanorods are studied.",
        "pages": "6585-6605",
        "DOI": "10.1088/0953-8984/18/29/003",
        "bibtex": "@article{Erhart_2006,\n abstract = {An interatomic potential for zinc oxide and its elemental constituents is derived based on an analytical bond-order formalism. The model potential provides a good description of the bulk properties of various solid structures of zinc oxide including cohesive energies, lattice parameters, and elastic constants. For the pure elements zinc and oxygen the energetics and structural parameters of a variety of bulk phases and in the case of oxygen also molecular structures are reproduced. The dependence of thermal and point defect properties on the cutoff parameters is discussed. As exemplary applications the irradiation of bulk zinc oxide and the elastic response of individual nanorods are studied.},\n author = {Paul Erhart and Niklas Juslin and Oliver Goy and Kai Nordlund and Ralf Müller and Karsten Albe},\n doi = {10.1088/0953-8984/18/29/003},\n journal = {Journal of Physics: Condensed Matter},\n month = {jun},\n number = {29},\n pages = {6585--6605},\n publisher = {IOP Publishing},\n title = {Analytic bond-order potential for atomistic simulations of zinc oxide},\n url = {https://doi.org/10.1088%2F0953-8984%2F18%2F29%2F003},\n volume = {18},\n year = {2006}\n}\n\n"
    }
}