{
    "citation": {
        "document-type": "journal",
        "title": "Atomistic modeling of the Al-H and Ni-H systems",
        "author": [
            {
                "given-name": "W.-S.",
                "surname": "Ko"
            },
            {
                "given-name": "J.-H.",
                "surname": "Shim"
            },
            {
                "given-name": "B.-J.",
                "surname": "Lee"
            }
        ],
        "publication-name": "Journal of Materials Research",
        "publication-date": {
            "year": 2011
        },
        "volume": 26,
        "issue": 12,
        "abstract": "Second nearest-neighbor modified embedded-atom method (MEAM) interatomic potentials for the Al-H and Ni-H binary systems have been developed on the basis of previously developed MEAM potentials of pure Al, Ni, and H. The potentials can describe various fundamental physical properties of the relevant binary alloys (structural, thermodynamic, defect, and dynamic properties of metastable hydrides or hydrogen in face-centered cubic solid solutions) in good agreement with experiments or first-principles calculations. The applicability of the present potentials to atomic level investigations of dynamic behavior of hydrogen atoms in metal membranes is also discussed.",
        "pages": "1552-1560",
        "DOI": "10.1557/jmr.2011.95",
        "bibtex": "@article{Ko_2011,\n abstract = {Second nearest-neighbor modified embedded-atom method (MEAM) interatomic potentials for the Al-H and Ni-H binary systems have been developed on the basis of previously developed MEAM potentials of pure Al, Ni, and H. The potentials can describe various fundamental physical properties of the relevant binary alloys (structural, thermodynamic, defect, and dynamic properties of metastable hydrides or hydrogen in face-centered cubic solid solutions) in good agreement with experiments or first-principles calculations. The applicability of the present potentials to atomic level investigations of dynamic behavior of hydrogen atoms in metal membranes is also discussed.},\n author = {Won-Seok Ko and Jae-Hyeok Shim and Byeong-Joo Lee},\n doi = {10.1557/jmr.2011.95},\n journal = {Journal of Materials Research},\n month = {jun},\n number = {12},\n pages = {1552--1560},\n publisher = {Cambridge University Press (CUP)},\n title = {Atomistic modeling of the Al-H and Ni-H systems},\n url = {https://doi.org/10.1557%2Fjmr.2011.95},\n volume = {26},\n year = {2011}\n}\n\n"
    }
}