{
    "interatomic-potential": {
        "key": "2b40fce7-360b-4fc8-9b1e-28787978181f",
        "id": "2022--Guo-J-Ward-L-Babuji-Y-et-al--Li-K-Cl",
        "record-version": "2022-08-08",
        "description": {
            "citation": {
                "document-type": "journal",
                "title": "Composition-transferable machine learning potential for LiCl-KCl molten salts validated by high-energy x-ray diffraction",
                "author": [
                    {
                        "given-name": "J.",
                        "surname": "Guo"
                    },
                    {
                        "given-name": "L.",
                        "surname": "Ward"
                    },
                    {
                        "given-name": "Y.",
                        "surname": "Babuji"
                    },
                    {
                        "given-name": "N.",
                        "surname": "Hoyt"
                    },
                    {
                        "given-name": "M.",
                        "surname": "Williamson"
                    },
                    {
                        "given-name": "I.",
                        "surname": "Foster"
                    },
                    {
                        "given-name": "N.",
                        "surname": "Jackson"
                    },
                    {
                        "given-name": "C.",
                        "surname": "Benmore"
                    },
                    {
                        "given-name": "G.",
                        "surname": "Sivaraman"
                    }
                ],
                "publication-name": "Physical Review B",
                "publication-date": {
                    "year": 2022
                },
                "volume": 106,
                "issue": 1,
                "abstract": "Unraveling the liquid structure of multicomponent molten salts is challenging due to the difficulty in conducting and interpreting high-temperature diffraction experiments. Motivated by this challenge, we developed composition-transferable Gaussian approximation potential (GAP) for molten LiCl-KCl. A DFT-SCAN accurate GAP is active-learned from only ~1100 training configurations drawn from 10 unique mixture compositions enriched with metadynamics. The GAP-computed structures show strong agreement across high-energy x-ray diffraction experiments, including for a eutectic not explicitly included in model training, thereby opening the possibility of composition discovery.",
                "pages": "014209",
                "DOI": "10.1103/physrevb.106.014209",
                "bibtex": "@article{Guo_2022,\n abstract = {Unraveling the liquid structure of multicomponent molten salts is challenging due to the difficulty in conducting and interpreting high-temperature diffraction experiments. Motivated by this challenge, we developed composition-transferable Gaussian approximation potential (GAP) for molten LiCl-KCl. A DFT-SCAN accurate GAP is active-learned from only ~1100 training configurations drawn from 10 unique mixture compositions enriched with metadynamics. The GAP-computed structures show strong agreement across high-energy x-ray diffraction experiments, including for a eutectic not explicitly included in model training, thereby opening the possibility of composition discovery.},\n author = {Jicheng Guo and Logan Ward and Yadu Babuji and Nathaniel Hoyt and Mark Williamson and Ian Foster and Nicholas Jackson and Chris Benmore and Ganesh Sivaraman},\n doi = {10.1103/physrevb.106.014209},\n journal = {Physical Review B},\n month = {jul},\n number = {1},\n pages = {014209},\n publisher = {American Physical Society (APS)},\n title = {Composition-transferable machine learning potential for LiCl-KCl molten salts validated by high-energy x-ray diffraction},\n url = {https://doi.org/10.1103%2Fphysrevb.106.014209},\n volume = {106},\n year = {2022}\n}\n\n"
            },
            "notes": {
                "text": "This potential was designed for molten LiCl-KCl. The fit did not include any pure LiCl melt training data, so it should be used with caution at ultra low concentrations of LiCl. For pure LiCl, it is recommended to use 2021--Sivaraman-G-Guo-J-Ward-L-et-al--Li-Cl."
            }
        },
        "implementation": {
            "key": "57746130-3028-4a5d-ad86-44f3796aa6f1",
            "id": "2022--Guo-J--Li-K-Cl--LAMMPS--ipr1",
            "status": "active",
            "date": "2022-08-08",
            "type": "GAP",
            "notes": {
                "text": "These files were provided by Ganesh Sivaraman on August 6, 2022. The link also hosts the potential files and some MD results for the potential."
            },
            "artifact": [
                {
                    "web-link": {
                        "URL": "https://www.ctcms.nist.gov/potentials/Download/2022--Guo-J-Ward-L-Babuji-Y-et-al--Li-K-Cl/1/GAP_LiCl_KCl.tar.gz",
                        "link-text": "GAP_LiCl_KCl.tar.gz"
                    }
                },
                {
                    "web-link": {
                        "URL": "https://www.ctcms.nist.gov/potentials/Download/2022--Guo-J-Ward-L-Babuji-Y-et-al--Li-K-Cl/1/train.xyz",
                        "link-text": "train.xyz"
                    }
                }
            ],
            "link": {
                "web-link": {
                    "URL": "https://acdc.alcf.anl.gov/mdf/detail/guo_gapml_model_hexrd_v1.1/",
                    "link-text": "https://acdc.alcf.anl.gov/mdf/detail/guo_gapml_model_hexrd_v1.1/"
                }
            }
        },
        "element": [
            "Li",
            "K",
            "Cl"
        ]
    }
}